{
  "schema_version": "research-evidence-package/v1",
  "package_id": "research_package_v1_ab2666150f650bba1442cbea",
  "evidence_package_state": "unavailable_source_fact_unresolved",
  "run_id": "research_run_v1_aaaaaaaaaaaaaaaaaaaaaaaa",
  "incident_ids": ["inc_v1_111111111111111111111111"],
  "episode_ids": [],
  "incident_locators": [
    {
      "schema_version": "p0_incident_normalization_v1",
      "incident_id": "inc_v1_111111111111111111111111",
      "detail_reference": "country_outage/2026-02-27 09:12:32/IR/1/r",
      "fact_link_status": "unresolved",
      "classification": "observation_only",
      "causal_conclusion": null
    }
  ],
  "bundles": [],
  "sidecar": null,
  "limitations_zh": [
    "未提供旧事实表只读冻结快照，因此未生成标准 Evidence Bundle v2。"
  ]
}
